[
  {
    "id": "application_layer",
    "version": 1,
    "owns": [
      "application_source_boundary",
      "application_bootstrap",
      "application_role_registration",
      "application_grid_registration",
      "application_policy_view_integration",
      "application_extension_packages",
      "application_layer_certification"
    ],
    "may_use": [
      "authorization_policies",
      "grid",
      "extensions",
      "multi_tenancy"
    ],
    "cannot_use": [
      "undocumented_internal_contracts",
      "protected_core_modification",
      "arbitrary_executable_path_discovery",
      "implicit_administrative_permissions",
      "unscoped_grid_relations"
    ],
    "invariants": [
      "product-specific behavior remains below application",
      "shared platform code never references product-specific constants",
      "custom roles declare explicit permissions and never replace protected roles",
      "every application grid registration includes an authorized scope",
      "controller authorization remains mandatory even when views hide denied actions",
      "application extensions are disabled by default and preserve community fallback",
      "application extension paths remain bounded to fixed roots",
      "certification evidence is deterministic credential free and cannot authorize publication"
    ],
    "required_tests": [
      "application_layer_bootstrap_test",
      "application_registrations_test",
      "application_extension_sample_test",
      "application_layer_certification_test",
      "application_layer_contract_workflow"
    ]
  },
  {
    "id": "distributions",
    "version": 1,
    "owns": [
      "distribution_manifest",
      "publication_evidence",
      "distribution_channel_state",
      "distribution_channel_policy",
      "publication_status",
      "publication_failure_code",
      "publication_recovery_policy",
      "distribution_inspection",
      "distribution_preflight",
      "github_release_publication",
      "distribution_artifact_bundle",
      "ghcr_semantic_promotion",
      "distribution_verification",
      "artifact_attestation",
      "distribution_bundle_preparation",
      "distribution_certification",
      "distribution_operations",
      "distribution_channel_observation"
    ],
    "may_use": [
      "platform_version",
      "release_metadata",
      "release_evidence",
      "release_consistency",
      "packaging_manifest",
      "sbom",
      "provenance",
      "repository_intelligence"
    ],
    "cannot_use": [
      "enterprise_repository_credentials",
      "proprietary_extension_artifacts",
      "arbitrary_distribution_channel",
      "automatic_publication_without_approval",
      "mutable_release_overwrite",
      "container_rebuild_during_release",
      "latest_tag_before_stable_release",
      "secret_persistence"
    ],
    "invariants": [
      "GitHub Releases and GHCR are the only supported baseline channels",
      "repository and package identity derive from the active GitHub repository context",
      "every publication binds one semantic version tag source commit and manifest digest",
      "GitHub Release and GHCR evidence refer to the same approved source commit",
      "semantic GHCR tags promote an existing commit-addressable image without rebuilding",
      "release publication requires approval through the protected release environment",
      "publication never overwrites an existing immutable tag release or image digest",
      "pre-stable releases never publish the latest image tag",
      "artifacts include checksums SBOMs provenance compatibility and operator notes",
      "publication evidence contains no credentials tokens or proprietary artifacts",
      "partial publication stops for operator review and resumes forward",
      "inspection and preflight are read-only and repeatable",
      "preflight blocks unavailable conflicting partial or replayed channel state",
      "GitHub Release publication consumes a checksum-verified artifact bundle",
      "GitHub Release publication targets the exact approved main commit",
      "GitHub Release publication requires the protected release environment",
      "GHCR semantic tags resolve to the existing commit-addressable image digest",
      "GHCR promotion performs no container rebuild and creates no latest tag",
      "release artifacts receive GitHub artifact attestations before publication",
      "post-publication verification is read-only and binds both channels to canonical release evidence",
      "verification evidence derives from a successful main run for the approved source commit",
      "channel observations derive from the approved distribution bundle and use read-only provider access",
      "provider credentials and raw responses are excluded from channel-state artifacts",
      "distribution bundles derive from successful packaging evidence for the same current main commit",
      "bundle preparation has read-only repository permissions and cannot publish channel state",
      "production-like certification covers preparation preflight plans verification and replay protection",
      "the complete Apache licensed community platform remains independently distributable"
    ],
    "required_tests": [
      "distributions_manifest_test",
      "distributions_channel_state_test",
      "distributions_inspector_test",
      "distributions_github_release_plan_test",
      "distributions_ghcr_promotion_plan_test",
      "distributions_verifier_test",
      "distribution_certification_test",
      "distribution_contract_certification"
    ]
  },
  {
    "id": "epic_10_validation",
    "version": 1,
    "owns": [
      "validation_plan",
      "governed_finding",
      "validation_certification",
      "release_blocker_policy",
      "expiring_risk_acceptance",
      "supported_environment_matrix",
      "measurable_release_thresholds",
      "deterministic_rc_plan",
      "protected_rc_approval_boundary",
      "representative_application_architecture",
      "representative_application_public_contract_boundary"
    ],
    "may_use": [
      "repository_intelligence",
      "release_evidence",
      "operational_readiness",
      "compatibility_metadata",
      "runtime_and_packaging_evidence",
      "documented_platform_contracts"
    ],
    "cannot_use": [
      "release_candidate_publication_during_planning",
      "automatic_release_publication",
      "silent_risk_acceptance",
      "secret_bearing_evidence",
      "undocumented_internal_contracts",
      "protected_core_modification",
      "mandatory_commercial_services"
    ],
    "invariants": [
      "validation contracts reject unknown fields",
      "critical and high findings cannot be accepted as residual risk",
      "accepted findings require explicit human approval and expiry",
      "passed certification requires every recorded phase to be complete",
      "passed certification rejects unresolved critical and high findings",
      "certification evidence is bound to a full source commit",
      "supported environments cite repository evidence and declare manual validation",
      "every quality category defines measurable targets and required evidence",
      "RC plans bind versioned inputs to a full source commit",
      "RC planning cannot approve or publish its own output",
      "representative application journeys use documented public contracts only",
      "representative application evidence is deterministic and credential free",
      "representative application architecture cannot authorize publication"
    ],
    "required_tests": [
      "epic_10_contract_validator_test",
      "epic_10_release_baseline_test",
      "epic_10_rc_preparation_test"
    ]
  },
  {
    "id": "extensions",
    "version": 1,
    "owns": [
      "community_enterprise_boundary",
      "extension_manifest",
      "extension_configuration",
      "extension_identity",
      "extension_capability",
      "extension_dependency",
      "extension_component_declaration",
      "extension_package_discovery",
      "extension_compatibility_preflight",
      "extension_dependency_order",
      "extension_inspection_report",
      "extension_registration_sdk",
      "extension_registry",
      "trusted_extension_loader",
      "extension_component_resolver",
      "extension_installed_state",
      "extension_lifecycle",
      "extension_readiness_gate",
      "extension_certification_fixture",
      "extension_certification_matrix",
      "extension_lifecycle_documentation",
      "application_extension_configuration",
      "application_extension_package"
    ],
    "may_use": [
      "platform_version",
      "repository_intelligence",
      "installed_platform_state",
      "upgrade_manifest"
    ],
    "cannot_use": [
      "proprietary_implementation_constants",
      "arbitrary_remote_download",
      "secret_persistence",
      "automatic_code_execution_before_validation",
      "runtime_installation",
      "hot_unloading",
      "compatibility_override",
      "monkey_patch_registration",
      "global_mutation_outside_registration_context"
    ],
    "invariants": [
      "the community core remains fully functional without extensions",
      "enterprise implementations remain in separately licensed repositories",
      "extension manifests are validated before entrypoint execution",
      "the complete enabled extension graph is compatible before any entrypoint executes",
      "inspection and preflight never require an extension entrypoint",
      "compatible load order is deterministic and dependency-first",
      "only a ready preflight plan can reach extension entrypoint execution",
      "extension registration is explicit atomic and limited to manifest declarations",
      "the registry is sealed after successful dependency-ordered loading",
      "loader failures expose stable codes and exception classes without internal messages",